{
  "schema_version": "instrument-benchmark/v1",
  "name": "GME instrument pilot v1",
  "license": "Apache-2.0 for manifest/code; generated fixtures CC0-1.0; local game assets excluded",
  "description": "Pilot benchmark: original controlled fixtures, provisional historical converter labels, same-bank sanity recipes, and explicitly unlabeled source cases.",
  "cases": [
    {
      "case_id": "ff4-flute",
      "record_id": "ff4-flute",
      "split": "historical-dev",
      "source": {
        "platform": "snes",
        "game_or_module": "Final Fantasy II (US) / IV",
        "driver": "FF2",
        "source_instrument_id": 7
      },
      "labels": {
        "routes": [
          {
            "kind": "gm_program",
            "program_0based": 73,
            "program_1based": 74,
            "melodic_percussion": false
          }
        ],
        "gm_families": [
          9
        ],
        "candidate_audition_octave_adjustment": 1
      },
      "label_basis": "historical_curated",
      "provenance": {
        "method": "Historical converter choice, retained as a provisional acceptable replacement, not acoustic ground truth. Legacy transpose is an audition octave count; observed pitch offset is unknown.",
        "source": {
          "kind": "local_game_source",
          "path": "snes/ff2/ff2mus.pl",
          "sha256": "f18896043b57276a43ad3bbc6326e4a6b927f65bf3701a6956c81e2ec16ea19a",
          "symbol": "@patchmap / @transpose",
          "instrument_id": 7
        }
      },
      "render_conditions": {
        "note": 60,
        "velocity": 96,
        "duration_seconds": 1.0,
        "tail_seconds": 0.5,
        "sample_rate": 22050,
        "effects": "dry unless source-native patch requires otherwise"
      },
      "asset": {
        "kind": "local_game_source",
        "path": "snes/ff2/ff2mus.pl",
        "sha256": "f18896043b57276a43ad3bbc6326e4a6b927f65bf3701a6956c81e2ec16ea19a",
        "symbol": "@patchmap / @transpose",
        "instrument_id": 7
      }
    },
    {
      "case_id": "ff4-trumpet",
      "record_id": "ff4-trumpet",
      "split": "historical-dev",
      "source": {
        "platform": "snes",
        "game_or_module": "Final Fantasy II (US) / IV",
        "driver": "FF2",
        "source_instrument_id": 6
      },
      "labels": {
        "routes": [
          {
            "kind": "gm_program",
            "program_0based": 56,
            "program_1based": 57,
            "melodic_percussion": false
          }
        ],
        "gm_families": [
          7
        ],
        "candidate_audition_octave_adjustment": 0
      },
      "label_basis": "historical_curated",
      "provenance": {
        "method": "Historical converter choice, retained as a provisional acceptable replacement, not acoustic ground truth. Legacy transpose is an audition octave count; observed pitch offset is unknown.",
        "source": {
          "kind": "local_game_source",
          "path": "snes/ff2/ff2mus.pl",
          "sha256": "f18896043b57276a43ad3bbc6326e4a6b927f65bf3701a6956c81e2ec16ea19a",
          "symbol": "@patchmap / @transpose",
          "instrument_id": 6
        }
      },
      "render_conditions": {
        "note": 60,
        "velocity": 96,
        "duration_seconds": 1.0,
        "tail_seconds": 0.5,
        "sample_rate": 22050,
        "effects": "dry unless source-native patch requires otherwise"
      },
      "asset": {
        "kind": "local_game_source",
        "path": "snes/ff2/ff2mus.pl",
        "sha256": "f18896043b57276a43ad3bbc6326e4a6b927f65bf3701a6956c81e2ec16ea19a",
        "symbol": "@patchmap / @transpose",
        "instrument_id": 6
      }
    },
    {
      "case_id": "ff4-bass",
      "record_id": "ff4-bass",
      "split": "historical-dev",
      "source": {
        "platform": "snes",
        "game_or_module": "Final Fantasy II (US) / IV",
        "driver": "FF2",
        "source_instrument_id": 9
      },
      "labels": {
        "routes": [
          {
            "kind": "gm_program",
            "program_0based": 34,
            "program_1based": 35,
            "melodic_percussion": false
          }
        ],
        "gm_families": [
          4
        ],
        "candidate_audition_octave_adjustment": -2
      },
      "label_basis": "historical_curated",
      "provenance": {
        "method": "Historical converter choice, retained as a provisional acceptable replacement, not acoustic ground truth. Legacy transpose is an audition octave count; observed pitch offset is unknown.",
        "source": {
          "kind": "local_game_source",
          "path": "snes/ff2/ff2mus.pl",
          "sha256": "f18896043b57276a43ad3bbc6326e4a6b927f65bf3701a6956c81e2ec16ea19a",
          "symbol": "@patchmap / @transpose",
          "instrument_id": 9
        }
      },
      "render_conditions": {
        "note": 60,
        "velocity": 96,
        "duration_seconds": 1.0,
        "tail_seconds": 0.5,
        "sample_rate": 22050,
        "effects": "dry unless source-native patch requires otherwise"
      },
      "asset": {
        "kind": "local_game_source",
        "path": "snes/ff2/ff2mus.pl",
        "sha256": "f18896043b57276a43ad3bbc6326e4a6b927f65bf3701a6956c81e2ec16ea19a",
        "symbol": "@patchmap / @transpose",
        "instrument_id": 9
      }
    },
    {
      "case_id": "tracker-major-inversion",
      "record_id": "tracker-major-inversion",
      "split": "synthetic-contract",
      "source": {
        "platform": "ProTracker",
        "game_or_module": "GME original oscillator samples",
        "driver": "generated M.K. module"
      },
      "labels": {
        "routes": [
          {
            "kind": "composite"
          }
        ],
        "component_offsets": [
          -5,
          0,
          4
        ],
        "abstain": false
      },
      "label_basis": "generated_exact",
      "provenance": {
        "method": "Exact authored component offsets relative to MIDI-60 trigger; original oscillator sums. Not a recording of commercial tracker music. Validate native module rendering separately.",
        "source": {
          "kind": "generated_fixture",
          "generator": "python -m instrument_analysis.fixtures",
          "fixture_id": "tracker-major-inversion",
          "license": "CC0-1.0"
        }
      },
      "render_conditions": {
        "note": 60,
        "velocity": 96,
        "duration_seconds": 1.0,
        "tail_seconds": 0.0,
        "sample_rate": 22050,
        "effects": "authored oscillator envelope or control signal; no hardware emulation"
      },
      "asset": {
        "kind": "generated_fixture",
        "generator": "python -m instrument_analysis.fixtures",
        "fixture_id": "tracker-major-inversion",
        "license": "CC0-1.0"
      }
    },
    {
      "case_id": "tracker-minor",
      "record_id": "tracker-minor",
      "split": "synthetic-contract",
      "source": {
        "platform": "ProTracker",
        "game_or_module": "GME original oscillator samples",
        "driver": "generated M.K. module"
      },
      "labels": {
        "routes": [
          {
            "kind": "composite"
          }
        ],
        "component_offsets": [
          0,
          3,
          7
        ],
        "abstain": false
      },
      "label_basis": "generated_exact",
      "provenance": {
        "method": "Exact authored component offsets relative to MIDI-60 trigger; original oscillator sums. Not a recording of commercial tracker music. Validate native module rendering separately.",
        "source": {
          "kind": "generated_fixture",
          "generator": "python -m instrument_analysis.fixtures",
          "fixture_id": "tracker-minor",
          "license": "CC0-1.0"
        }
      },
      "render_conditions": {
        "note": 60,
        "velocity": 96,
        "duration_seconds": 1.0,
        "tail_seconds": 0.0,
        "sample_rate": 22050,
        "effects": "authored oscillator envelope or control signal; no hardware emulation"
      },
      "asset": {
        "kind": "generated_fixture",
        "generator": "python -m instrument_analysis.fixtures",
        "fixture_id": "tracker-minor",
        "license": "CC0-1.0"
      }
    },
    {
      "case_id": "tracker-sus4",
      "record_id": "tracker-sus4",
      "split": "synthetic-contract",
      "source": {
        "platform": "ProTracker",
        "game_or_module": "GME original oscillator samples",
        "driver": "generated M.K. module"
      },
      "labels": {
        "routes": [
          {
            "kind": "composite"
          }
        ],
        "component_offsets": [
          0,
          5,
          7
        ],
        "abstain": false
      },
      "label_basis": "generated_exact",
      "provenance": {
        "method": "Exact authored component offsets relative to MIDI-60 trigger; original oscillator sums. Not a recording of commercial tracker music. Validate native module rendering separately.",
        "source": {
          "kind": "generated_fixture",
          "generator": "python -m instrument_analysis.fixtures",
          "fixture_id": "tracker-sus4",
          "license": "CC0-1.0"
        }
      },
      "render_conditions": {
        "note": 60,
        "velocity": 96,
        "duration_seconds": 1.0,
        "tail_seconds": 0.0,
        "sample_rate": 22050,
        "effects": "authored oscillator envelope or control signal; no hardware emulation"
      },
      "asset": {
        "kind": "generated_fixture",
        "generator": "python -m instrument_analysis.fixtures",
        "fixture_id": "tracker-sus4",
        "license": "CC0-1.0"
      }
    },
    {
      "case_id": "tracker-power-octave",
      "record_id": "tracker-power-octave",
      "split": "synthetic-contract",
      "source": {
        "platform": "ProTracker",
        "game_or_module": "GME original oscillator samples",
        "driver": "generated M.K. module"
      },
      "labels": {